{
  "$schema": "./plan.schema.json",
  "id": "PLAN-001",
  "title": "Documentation structure and content master plan",
  "version": "0.1.0",
  "updated": "2026-09-27",
  "owner": "governance",
  "summary": "Bring the zuri-next specification into full conformance with STD-001..STD-004, raise the content quality of every feature folder to a reviewable standard, and leave the repository ready for the first implementation slice. Structure first, then requirements, design, verification, approval, views, and finally the hand-off to code.",
  "how_to_use": [
    "This file is the canonical plan. The `status` of each task and the `done` flag of each checklist item are changed here, in a pull request, like any other document.",
    "Every phase has exit criteria; a phase is closed only when all of them hold and `node tools/validate-docs.mjs` still reports 0 errors and 0 warnings.",
    "Every task has acceptance criteria in Given / When / Then form and a `verify` command where one exists. Run the command before marking the task done.",
    "The dashboard (dashboard.html next to this file) renders this JSON. Ticks made in the dashboard are stored in the viewer's browser only; copy the exported JSON back into this file to make them official.",
    "IDs inside this plan (P1-T2, P1-T2-C1, P1-T2-A1) are plan-local and are never STD-002 artifact IDs."
  ],
  "lanes": [
    { "id": "governance", "name": "Governance", "description": "Standards, ADRs, approval decisions" },
    { "id": "tooling", "name": "Tooling", "description": "tools/*.mjs, CI, generated views" },
    { "id": "content", "name": "Content", "description": "Feature folders: requirements, design, verification" },
    { "id": "domains", "name": "Domain owners", "description": "Per-domain review and approval, one owner per DOM-*" }
  ],
  "status_values": ["todo", "doing", "blocked", "done"],
  "baseline": {
    "date": "2026-09-27",
    "commit": "eb38090",
    "note": "Measured on main after PR #1. Counts come from the commands listed under each metric; refresh them with tools/plan-metrics.mjs once P0-T2 lands."
  },
  "metrics": [
    { "id": "validator.errors", "label": "validate-docs errors", "baseline": 0, "target": 0, "direction": "min", "how": "node tools/validate-docs.mjs" },
    { "id": "validator.warnings", "label": "validate-docs warnings", "baseline": 0, "target": 0, "direction": "min", "how": "node tools/validate-docs.mjs" },
    { "id": "structure.violations", "label": "STD-003 structure violations", "baseline": 18, "target": 0, "direction": "min", "how": "node tools/validate-docs.mjs --structure (after P0-T1); today: 9 SERVICE.md without hosts:, 9 without implements:" },
    { "id": "features.total", "label": "Features", "baseline": 97, "target": 97, "direction": "info", "how": "ls docs/features | wc -l" },
    { "id": "features.approved", "label": "Features approved", "baseline": 31, "target": 97, "direction": "max", "how": "grep -l '^status: approved' docs/features/*/feature.md | wc -l" },
    { "id": "features.draft", "label": "Features in draft", "baseline": 54, "target": 0, "direction": "min", "how": "grep -l '^status: draft' docs/features/*/feature.md | wc -l" },
    { "id": "features.proposed", "label": "Features proposed", "baseline": 12, "target": 0, "direction": "min", "how": "grep -l '^status: proposed' docs/features/*/feature.md | wc -l" },
    { "id": "fr.total", "label": "Functional requirements", "baseline": 411, "target": 411, "direction": "info", "how": "find docs/features -name 'FR-*.md' | wc -l" },
    { "id": "fr.empty_verification", "label": "FRs with an empty Verification section", "baseline": 55, "target": 0, "direction": "min", "how": "FR files whose '## Verification' section names no TC" },
    { "id": "fr.declared", "label": "FRs still 'declared' (no behaviour yet)", "baseline": 16, "target": 0, "direction": "min", "how": "grep -l '^delivery: declared' docs/features/*/requirements/FR-*.md | wc -l; each becomes building, or retired with a reason" },
    { "id": "fr.legacy_impl_path", "label": "FRs whose Implementation section is a zuri-ai path", "baseline": 168, "target": 0, "direction": "min", "how": "grep -lE '^- apps/server' docs/features/*/requirements/FR-*.md | wc -l" },
    { "id": "ac.total", "label": "Acceptance criteria", "baseline": 961, "target": 961, "direction": "info", "how": "unique AC-ids in FR files" },
    { "id": "ac.not_gwt", "label": "ACs not in Given / When / Then form", "baseline": 190, "target": 0, "direction": "min", "how": "AC lines that do not contain given, when and then" },
    { "id": "tc.total", "label": "Test cases", "baseline": 349, "target": 349, "direction": "info", "how": "TC headings in verification.md" },
    { "id": "tc.bound_local", "label": "TCs bound to a test in this repository", "baseline": 0, "target": 349, "direction": "max", "how": "TC entries whose test: path exists in this repository (all 349 point to zuri-ai today)" },
    { "id": "sdd.thin", "label": "Design docs under 25 lines", "baseline": 38, "target": 0, "direction": "min", "how": "wc -l docs/features/*/design.md | awk '$1<25'" },
    { "id": "std.proposed", "label": "Standards not yet approved", "baseline": 1, "target": 0, "direction": "min", "how": "STD-003 is 'proposed'" },
    { "id": "views.stale", "label": "Stale generated views", "baseline": 0, "target": 0, "direction": "min", "how": "node tools/generate-views.mjs --check" }
  ],
  "phases": [
    {
      "id": "P0",
      "title": "Measure and guard",
      "goal": "Make every gap in this plan visible from a command, and make regressions fail a pull request, before any content is touched.",
      "target_window": "2026-10",
      "exit_criteria": [
        "validate-docs has a --structure mode that reports every STD-003 R1..R6 violation listed in this plan.",
        "tools/plan-metrics.mjs prints every metric id in this file with its current value.",
        "A CI workflow runs validate-docs, generate-views --check and the structure check on every pull request."
      ],
      "tasks": [
        {
          "id": "P0-T1",
          "title": "Add the STD-003 structure check to validate-docs",
          "lane": "tooling",
          "status": "todo",
          "effort": "M",
          "depends_on": [],
          "why": "validate-docs proves IDs and relations (STD-002 R8) but nothing checks folder shape, required files, frontmatter keys or naming. The 9 SERVICE.md gaps were invisible to it.",
          "touches": ["tools/validate-docs.mjs", "tools/lib/"],
          "checklist": [
            { "id": "P0-T1-C1", "text": "Feature folder: name FEAT-nnn-<slug>; feature.md, requirements/, design.md, verification.md present; no other entries", "done": false },
            { "id": "P0-T1-C2", "text": "feature.md frontmatter: id matches folder; type in {domain-feature, cross-domain-feature}; title, owner, status, delivery present; participants and parts/ only for cross-domain", "done": false },
            { "id": "P0-T1-C3", "text": "Requirement files: FR|NFR-<feat>-<nnn>-<slug>.md; id matches filename; one requirement per file; FR has '## Acceptance criteria' with at least one AC; cross-domain FR has part and owner", "done": false },
            { "id": "P0-T1-C4", "text": "Domain folder: only README.md, decisions.md, contracts.md; generated block markers present; slug registered in registry/domains.yaml", "done": false },
            { "id": "P0-T1-C5", "text": "Service folder: SERVICE.md with hosts: and implements:", "done": false },
            { "id": "P0-T1-C6", "text": "Structure findings are errors, not warnings, once P1 closes; until then they are reported under a separate STRUCTURE heading so ERRORS stays 0", "done": false }
          ],
          "acceptance": [
            { "id": "P0-T1-A1", "given": "the repository at the baseline commit", "when": "node tools/validate-docs.mjs --structure runs", "then": "it lists exactly the 18 SERVICE.md findings (9 missing hosts, 9 missing implements) and nothing else", "verify": "node tools/validate-docs.mjs --structure" },
            { "id": "P0-T1-A2", "given": "a feature folder renamed to a slug without its FEAT id", "when": "the check runs", "then": "the folder is reported with its path and the rule it breaks (STD-003 R3)", "verify": "node tools/validate-docs.mjs --structure --scope FEAT-001" }
          ]
        },
        {
          "id": "P0-T2",
          "title": "Write tools/plan-metrics.mjs",
          "lane": "tooling",
          "status": "todo",
          "effort": "S",
          "depends_on": [],
          "why": "The metric block in this plan was counted by hand today. A script makes the dashboard honest and lets CI post progress.",
          "touches": ["tools/plan-metrics.mjs", "docs/governance/plans/PLAN-001.json"],
          "checklist": [
            { "id": "P0-T2-C1", "text": "One function per metric id in PLAN-001.json; unknown ids fail loudly", "done": false },
            { "id": "P0-T2-C2", "text": "--json prints { id: value }; --write updates the `current` field of each metric in the plan file", "done": false },
            { "id": "P0-T2-C3", "text": "Uses only the Node standard library, like the other tools", "done": false }
          ],
          "acceptance": [
            { "id": "P0-T2-A1", "given": "the baseline commit", "when": "node tools/plan-metrics.mjs --json runs", "then": "every value equals the baseline value recorded in this file", "verify": "node tools/plan-metrics.mjs --json" }
          ]
        },
        {
          "id": "P0-T3",
          "title": "CI workflow for documentation pull requests",
          "lane": "tooling",
          "status": "todo",
          "effort": "S",
          "depends_on": ["P0-T1"],
          "why": "The definition of done in CLAUDE.md is enforced by habit only. A failing check is cheaper than a review comment.",
          "touches": [".github/workflows/docs.yml"],
          "checklist": [